complaint_id,category,narrative,amount_lost,victim_city,modus_operandi_tags
RAG_CMP_0144,digital_arrest,"On May 19, 2024, I was at my residence in Pune when I received an unexpected phone call at around 11:48. The caller identified themselves as a senior investigating officer from the Police. The person sounded extremely authoritative and informed me that my Aadhaar card and PAN card details had been found implicated in a major money laundering and contraband smuggling case involving millions of rupees. I am a 53-year-old citizen with no criminal record, and I was completely terrified by this sudden allegation. They immediately escalated the situation by ordering me to isolate myself in an empty room and forcing me to join a Zoom call. Once connected, I saw individuals dressed in official-looking uniforms sitting in a room that closely resembled a real police station, complete with national emblems and official insignia. They declared that I was under 'digital arrest' and strictly prohibited me from muting the microphone, turning off the camera, or contacting any family members or legal counsel. They displayed highly realistic forged documents bearing my name, photograph, and official government stamps, claiming an arrest warrant had already been authorized by the Supreme Court. I was kept under constant surveillance on this harrowing call for over 28 hours without any break. Exploiting my extreme fear, confusion, and panic, the impersonators instructed me to transfer all my personal savings to a 'secret secure Police investigation account' to verify my innocence. They promised the entire amount would be reversed back to my account within 24 hours once my financial audit was clear. Out of sheer panic, I initiated multiple transactions totaling Rs. 3,758,135 via crypto exchange transfer. It was only after the perpetrators abruptly disconnected the call the next evening that I contacted the actual local police station and realized I had been the victim of an elaborate and devastating psychological scam.",3758135,Pune,"digital_arrest, impersonation, police, zoom_call, coercion"
RAG_CMP_0365,fake_customer_care,"I was facing issues with my broadband connection in Kolkata. I googled the customer care number and called the first result. The person on the other end asked me to install a remote access app called AnyDesk to fix the router settings. Within minutes of granting access, they opened my banking app and transferred Rs. 440,707 out of my account. I am 34 years old.",440707,Kolkata,"fake_customer_care, financial_loss, cybercrime"
RAG_CMP_0073,digital_arrest,"On June 23, 2024, I was at my residence in Ahmedabad when I received an unexpected phone call at around 12:56. The caller identified themselves as a senior investigating officer from the ED. The person sounded extremely authoritative and informed me that my Aadhaar card and PAN card details had been found implicated in a major money laundering and contraband smuggling case involving millions of rupees. I am a 45-year-old citizen with no criminal record, and I was completely terrified by this sudden allegation. They immediately escalated the situation by ordering me to isolate myself in an empty room and forcing me to join a Zoom call. Once connected, I saw individuals dressed in official-looking uniforms sitting in a room that closely resembled a real police station, complete with national emblems and official insignia. They declared that I was under 'digital arrest' and strictly prohibited me from muting the microphone, turning off the camera, or contacting any family members or legal counsel. They displayed highly realistic forged documents bearing my name, photograph, and official government stamps, claiming an arrest warrant had already been authorized by the Supreme Court. I was kept under constant surveillance on this harrowing call for over 18 hours without any break. Exploiting my extreme fear, confusion, and panic, the impersonators instructed me to transfer all my personal savings to a 'secret secure ED investigation account' to verify my innocence. They promised the entire amount would be reversed back to my account within 24 hours once my financial audit was clear. Out of sheer panic, I initiated multiple transactions totaling Rs. 3,026,487 via bank transfer. It was only after the perpetrators abruptly disconnected the call the next evening that I contacted the actual local police station and realized I had been the victim of an elaborate and devastating psychological scam.",3026487,Ahmedabad,"digital_arrest, impersonation, ed, zoom_call, coercion"
RAG_CMP_0031,digital_arrest,"My nightmare began on the morning of May 15, 2024 in Jaipur. I received an urgent call from someone pretending to be a customs official at the international airport. They claimed that a parcel addressed to me contained illegal narcotics and multiple expired passports. When I denied any knowledge of the parcel, they stated the matter was being escalated to the TRAI and forced me to immediately download an application to initiate a Skype call. I am 58 years old and not very tech-savvy, so I blindly followed their instructions out of fear of legal trouble. Upon joining the call, a person dressed as a senior TRAI director interrogated me aggressively. They digitally projected a fake FIR document onto the screen, which had my exact residential address and identity details. They told me I could not leave the camera frame and declared me under 'digital arrest'. I was held hostage virtually for 17 straight hours. Whenever I requested to drink water or use the restroom, they threatened to send local constables to publicly arrest me in front of my neighbors. They convinced me to temporarily transfer Rs. 2,685,565 to an 'auditor verification ledger' via bank transfer to prove that my funds were legally acquired and not linked to the intercepted parcel. Believing my life and career were on the line, I complied with all their demands. After the initial transfer, they demanded further payments, at which point I became suspicious and disconnected. I immediately checked with my bank, but the funds had already been moved.",2685565,Jaipur,"digital_arrest, impersonation, trai, skype_call, coercion"
RAG_CMP_0252,upi_phishing,"I received an SMS stating that my electricity bill for my Kolkata residence was unpaid and power would be disconnected tonight. The message contained a payment link. I clicked it and was redirected to a payment gateway that looked legitimate. I entered my UPI details, and Rs. 181,949 was withdrawn automatically. The sender's number is now switched off.",181949,Kolkata,"upi_phishing, financial_loss, cybercrime"
RAG_CMP_0457,loan_app_fraud,"I downloaded a quick loan app from the Play Store to cover a medical emergency in Kolkata. I applied for a 5,000 rupee loan but they only disbursed 3,000, claiming the rest was processing fees. A week later, they demanded Rs. 112,071 and threatened to send morphed obscene photos of me to all my contacts using the contact list permission I had originally granted. The harassment was unbearable.",112071,Kolkata,"loan_app_fraud, financial_loss, cybercrime"
RAG_CMP_0122,digital_arrest,"On December 22, 2024, I was at my residence in Hyderabad when I received an unexpected phone call at around 16:26. The caller identified themselves as a senior investigating officer from the ED. The person sounded extremely authoritative and informed me that my Aadhaar card and PAN card details had been found implicated in a major money laundering and contraband smuggling case involving millions of rupees. I am a 59-year-old citizen with no criminal record, and I was completely terrified by this sudden allegation. They immediately escalated the situation by ordering me to isolate myself in an empty room and forcing me to join a Zoom call. Once connected, I saw individuals dressed in official-looking uniforms sitting in a room that closely resembled a real police station, complete with national emblems and official insignia. They declared that I was under 'digital arrest' and strictly prohibited me from muting the microphone, turning off the camera, or contacting any family members or legal counsel. They displayed highly realistic forged documents bearing my name, photograph, and official government stamps, claiming an arrest warrant had already been authorized by the Supreme Court. I was kept under constant surveillance on this harrowing call for over 44 hours without any break. Exploiting my extreme fear, confusion, and panic, the impersonators instructed me to transfer all my personal savings to a 'secret secure ED investigation account' to verify my innocence. They promised the entire amount would be reversed back to my account within 24 hours once my financial audit was clear. Out of sheer panic, I initiated multiple transactions totaling Rs. 3,162,270 via crypto exchange transfer. It was only after the perpetrators abruptly disconnected the call the next evening that I contacted the actual local police station and realized I had been the victim of an elaborate and devastating psychological scam.",3162270,Hyderabad,"digital_arrest, impersonation, ed, zoom_call, coercion"
RAG_CMP_0272,qr_code_scam,"While visiting a local shop in Bangalore, I tried to pay using a QR code pasted on the wall. After scanning, I made a payment of Rs. 449,867. Later, the shopkeeper said he didn't receive it. It turns out someone had pasted a fake QR code sticker over the original one. I lost my money and had to pay the shopkeeper again.",449867,Bangalore,"qr_code_scam, financial_loss, cybercrime"
RAG_CMP_0106,digital_arrest,"I am filing this formal complaint regarding a highly sophisticated cyber fraud that occurred on January 19, 2024. I am a 46-year-old resident of Delhi. I received an automated Interactive Voice Response (IVR) call claiming that a mobile number registered in my name was being used to send illegal threat messages and that my cellular services would be blocked in two hours. I pressed '9' to speak to an executive and was connected to a man claiming to represent Police. He transferred my call to what he described as the 'cyber crime investigation branch'. I was then manipulated into logging on to a Zoom call for formal questioning. The individuals on the screen were wearing uniforms and sitting behind heavy wooden desks with the Police logo prominently displayed in the background. They informed me that multiple bank accounts had been opened using my PAN card to fund illicit activities across international borders. They convinced me that I was a prime suspect and placed me under a so-called 'digital arrest'. They claimed that my local physical movements were currently being tracked and any attempt to log off would result in immediate physical detention by a local raid team. Under incredible mental distress and duress spanning 36 hours, they convinced me that the only way to avoid formal imprisonment was to deposit a 'security clearance bond'. Desperate to defend my reputation and believing their threats were completely legitimate, I gathered funds by liquidating my fixed deposits and transferred Rs. 4,143,200 using IMPS/NEFT to the accounts they dictated. The scammers assured me the money was just held in an escrow account. I am left financially ruined and deeply traumatized by this impersonation scam.",4143200,Delhi,"digital_arrest, impersonation, police, zoom_call, coercion"
RAG_CMP_0054,digital_arrest,"My nightmare began on the morning of August 25, 2024 in Ahmedabad. I received an urgent call from someone pretending to be a customs official at the international airport. They claimed that a parcel addressed to me contained illegal narcotics and multiple expired passports. When I denied any knowledge of the parcel, they stated the matter was being escalated to the Customs and forced me to immediately download an application to initiate a WhatsApp video call. I am 28 years old and not very tech-savvy, so I blindly followed their instructions out of fear of legal trouble. Upon joining the call, a person dressed as a senior Customs director interrogated me aggressively. They digitally projected a fake FIR document onto the screen, which had my exact residential address and identity details. They told me I could not leave the camera frame and declared me under 'digital arrest'. I was held hostage virtually for 10 straight hours. Whenever I requested to drink water or use the restroom, they threatened to send local constables to publicly arrest me in front of my neighbors. They convinced me to temporarily transfer Rs. 3,879,079 to an 'auditor verification ledger' via UPI to prove that my funds were legally acquired and not linked to the intercepted parcel. Believing my life and career were on the line, I complied with all their demands. After the initial transfer, they demanded further payments, at which point I became suspicious and disconnected. I immediately checked with my bank, but the funds had already been moved.",3879079,Ahmedabad,"digital_arrest, impersonation, customs, whatsapp_video_call, coercion"
RAG_CMP_0158,digital_arrest,"I am filing this formal complaint regarding a highly sophisticated cyber fraud that occurred on February 13, 2024. I am a 34-year-old resident of Lucknow. I received an automated Interactive Voice Response (IVR) call claiming that a mobile number registered in my name was being used to send illegal threat messages and that my cellular services would be blocked in two hours. I pressed '9' to speak to an executive and was connected to a man claiming to represent CBI. He transferred my call to what he described as the 'cyber crime investigation branch'. I was then manipulated into logging on to a Zoom call for formal questioning. The individuals on the screen were wearing uniforms and sitting behind heavy wooden desks with the CBI logo prominently displayed in the background. They informed me that multiple bank accounts had been opened using my PAN card to fund illicit activities across international borders. They convinced me that I was a prime suspect and placed me under a so-called 'digital arrest'. They claimed that my local physical movements were currently being tracked and any attempt to log off would result in immediate physical detention by a local raid team. Under incredible mental distress and duress spanning 47 hours, they convinced me that the only way to avoid formal imprisonment was to deposit a 'security clearance bond'. Desperate to defend my reputation and believing their threats were completely legitimate, I gathered funds by liquidating my fixed deposits and transferred Rs. 2,930,964 using UPI to the accounts they dictated. The scammers assured me the money was just held in an escrow account. I am left financially ruined and deeply traumatized by this impersonation scam.",2930964,Lucknow,"digital_arrest, impersonation, cbi, zoom_call, coercion"
RAG_CMP_0373,fake_customer_care,"My flight was cancelled and I was looking for an airline refund. I found a toll-free number online. The 'agent' told me to pay a small processing fee of Rs. 10 to receive the full refund. They sent a link, but the transaction actually debited Rs. 3,723 from my savings. I reported it to the local police in Delhi.",3723,Delhi,"fake_customer_care, financial_loss, cybercrime"
RAG_CMP_0378,fake_customer_care,"My flight was cancelled and I was looking for an airline refund. I found a toll-free number online. The 'agent' told me to pay a small processing fee of Rs. 10 to receive the full refund. They sent a link, but the transaction actually debited Rs. 217,955 from my savings. I reported it to the local police in Mumbai.",217955,Mumbai,"fake_customer_care, financial_loss, cybercrime"
RAG_CMP_0193,digital_arrest,"My nightmare began on the morning of October 04, 2024 in Ahmedabad. I received an urgent call from someone pretending to be a customs official at the international airport. They claimed that a parcel addressed to me contained illegal narcotics and multiple expired passports. When I denied any knowledge of the parcel, they stated the matter was being escalated to the Police and forced me to immediately download an application to initiate a Skype call. I am 30 years old and not very tech-savvy, so I blindly followed their instructions out of fear of legal trouble. Upon joining the call, a person dressed as a senior Police director interrogated me aggressively. They digitally projected a fake FIR document onto the screen, which had my exact residential address and identity details. They told me I could not leave the camera frame and declared me under 'digital arrest'. I was held hostage virtually for 37 straight hours. Whenever I requested to drink water or use the restroom, they threatened to send local constables to publicly arrest me in front of my neighbors. They convinced me to temporarily transfer Rs. 594,748 to an 'auditor verification ledger' via IMPS/NEFT to prove that my funds were legally acquired and not linked to the intercepted parcel. Believing my life and career were on the line, I complied with all their demands. After the initial transfer, they demanded further payments, at which point I became suspicious and disconnected. I immediately checked with my bank, but the funds had already been moved.",594748,Ahmedabad,"digital_arrest, impersonation, police, skype_call, coercion"
RAG_CMP_0337,fake_customer_care,"My flight was cancelled and I was looking for an airline refund. I found a toll-free number online. The 'agent' told me to pay a small processing fee of Rs. 10 to receive the full refund. They sent a link, but the transaction actually debited Rs. 431,750 from my savings. I reported it to the local police in Pune.",431750,Pune,"fake_customer_care, financial_loss, cybercrime"
RAG_CMP_0389,investment_fraud,"I was added to a Telegram group promising 300% returns on crypto investments. The members shared fake screenshots of huge profits. I am 40 years old and seeking financial stability in Ahmedabad. I invested an initial sum, which showed a profit on their fake portal. Encouraged, I invested a total of Rs. 94,133. When I tried to withdraw, they blocked my account and vanished.",94133,Ahmedabad,"investment_fraud, financial_loss, cybercrime"
RAG_CMP_0001,digital_arrest,"My nightmare began on the morning of February 22, 2024 in Delhi. I received an urgent call from someone pretending to be a customs official at the international airport. They claimed that a parcel addressed to me contained illegal narcotics and multiple expired passports. When I denied any knowledge of the parcel, they stated the matter was being escalated to the Police and forced me to immediately download an application to initiate a Skype call. I am 26 years old and not very tech-savvy, so I blindly followed their instructions out of fear of legal trouble. Upon joining the call, a person dressed as a senior Police director interrogated me aggressively. They digitally projected a fake FIR document onto the screen, which had my exact residential address and identity details. They told me I could not leave the camera frame and declared me under 'digital arrest'. I was held hostage virtually for 10 straight hours. Whenever I requested to drink water or use the restroom, they threatened to send local constables to publicly arrest me in front of my neighbors. They convinced me to temporarily transfer Rs. 1,922,427 to an 'auditor verification ledger' via bank transfer to prove that my funds were legally acquired and not linked to the intercepted parcel. Believing my life and career were on the line, I complied with all their demands. After the initial transfer, they demanded further payments, at which point I became suspicious and disconnected. I immediately checked with my bank, but the funds had already been moved.",1922427,Delhi,"digital_arrest, impersonation, police, skype_call, coercion"
RAG_CMP_0172,digital_arrest,"On July 10, 2024, I was at my residence in Ahmedabad when I received an unexpected phone call at around 11:24. The caller identified themselves as a senior investigating officer from the CBI. The person sounded extremely authoritative and informed me that my Aadhaar card and PAN card details had been found implicated in a major money laundering and contraband smuggling case involving millions of rupees. I am a 47-year-old citizen with no criminal record, and I was completely terrified by this sudden allegation. They immediately escalated the situation by ordering me to isolate myself in an empty room and forcing me to join a Zoom call. Once connected, I saw individuals dressed in official-looking uniforms sitting in a room that closely resembled a real police station, complete with national emblems and official insignia. They declared that I was under 'digital arrest' and strictly prohibited me from muting the microphone, turning off the camera, or contacting any family members or legal counsel. They displayed highly realistic forged documents bearing my name, photograph, and official government stamps, claiming an arrest warrant had already been authorized by the Supreme Court. I was kept under constant surveillance on this harrowing call for over 34 hours without any break. Exploiting my extreme fear, confusion, and panic, the impersonators instructed me to transfer all my personal savings to a 'secret secure CBI investigation account' to verify my innocence. They promised the entire amount would be reversed back to my account within 24 hours once my financial audit was clear. Out of sheer panic, I initiated multiple transactions totaling Rs. 3,375,696 via UPI. It was only after the perpetrators abruptly disconnected the call the next evening that I contacted the actual local police station and realized I had been the victim of an elaborate and devastating psychological scam.",3375696,Ahmedabad,"digital_arrest, impersonation, cbi, zoom_call, coercion"
RAG_CMP_0426,investment_fraud,"I was added to a Telegram group promising 300% returns on crypto investments. The members shared fake screenshots of huge profits. I am 43 years old and seeking financial stability in Bangalore. I invested an initial sum, which showed a profit on their fake portal. Encouraged, I invested a total of Rs. 364,560. When I tried to withdraw, they blocked my account and vanished.",364560,Bangalore,"investment_fraud, financial_loss, cybercrime"
RAG_CMP_0356,fake_customer_care,"My flight was cancelled and I was looking for an airline refund. I found a toll-free number online. The 'agent' told me to pay a small processing fee of Rs. 10 to receive the full refund. They sent a link, but the transaction actually debited Rs. 50,997 from my savings. I reported it to the local police in Jaipur.",50997,Jaipur,"fake_customer_care, financial_loss, cybercrime"
RAG_CMP_0326,fake_customer_care,"I was facing issues with my broadband connection in Ahmedabad. I googled the customer care number and called the first result. The person on the other end asked me to install a remote access app called AnyDesk to fix the router settings. Within minutes of granting access, they opened my banking app and transferred Rs. 365,708 out of my account. I am 35 years old.",365708,Ahmedabad,"fake_customer_care, financial_loss, cybercrime"
RAG_CMP_0178,digital_arrest,"My nightmare began on the morning of September 26, 2024 in Kolkata. I received an urgent call from someone pretending to be a customs official at the international airport. They claimed that a parcel addressed to me contained illegal narcotics and multiple expired passports. When I denied any knowledge of the parcel, they stated the matter was being escalated to the Police and forced me to immediately download an application to initiate a video call. I am 36 years old and not very tech-savvy, so I blindly followed their instructions out of fear of legal trouble. Upon joining the call, a person dressed as a senior Police director interrogated me aggressively. They digitally projected a fake FIR document onto the screen, which had my exact residential address and identity details. They told me I could not leave the camera frame and declared me under 'digital arrest'. I was held hostage virtually for 6 straight hours. Whenever I requested to drink water or use the restroom, they threatened to send local constables to publicly arrest me in front of my neighbors. They convinced me to temporarily transfer Rs. 3,074,963 to an 'auditor verification ledger' via RTGS to prove that my funds were legally acquired and not linked to the intercepted parcel. Believing my life and career were on the line, I complied with all their demands. After the initial transfer, they demanded further payments, at which point I became suspicious and disconnected. I immediately checked with my bank, but the funds had already been moved.",3074963,Kolkata,"digital_arrest, impersonation, police, video_call, coercion"
RAG_CMP_0278,qr_code_scam,"A person approached me saying he had urgent cash but needed an online transfer. He gave me Rs. 2000 in physical cash and asked me to scan his QR code to transfer the equivalent amount. I scanned and authorized Rs. 124,890, but soon realized the cash he handed me were counterfeit notes. I am a 64-year-old resident of Chennai.",124890,Chennai,"qr_code_scam, financial_loss, cybercrime"
