complaint_id,category,narrative,amount_lost,victim_city,modus_operandi_tags
RAG_CMP_0493,loan_app_fraud,"I downloaded a quick loan app from the Play Store to cover a medical emergency in Pune. I applied for a 5,000 rupee loan but they only disbursed 3,000, claiming the rest was processing fees. A week later, they demanded Rs. 230,368 and threatened to send morphed obscene photos of me to all my contacts using the contact list permission I had originally granted. The harassment was unbearable.",230368,Pune,"loan_app_fraud, financial_loss, cybercrime"
RAG_CMP_0152,digital_arrest,"My nightmare began on the morning of November 26, 2024 in Delhi. I received an urgent call from someone pretending to be a customs official at the international airport. They claimed that a parcel addressed to me contained illegal narcotics and multiple expired passports. When I denied any knowledge of the parcel, they stated the matter was being escalated to the Customs and forced me to immediately download an application to initiate a WhatsApp video call. I am 58 years old and not very tech-savvy, so I blindly followed their instructions out of fear of legal trouble. Upon joining the call, a person dressed as a senior Customs director interrogated me aggressively. They digitally projected a fake FIR document onto the screen, which had my exact residential address and identity details. They told me I could not leave the camera frame and declared me under 'digital arrest'. I was held hostage virtually for 48 straight hours. Whenever I requested to drink water or use the restroom, they threatened to send local constables to publicly arrest me in front of my neighbors. They convinced me to temporarily transfer Rs. 2,995,238 to an 'auditor verification ledger' via IMPS/NEFT to prove that my funds were legally acquired and not linked to the intercepted parcel. Believing my life and career were on the line, I complied with all their demands. After the initial transfer, they demanded further payments, at which point I became suspicious and disconnected. I immediately checked with my bank, but the funds had already been moved.",2995238,Delhi,"digital_arrest, impersonation, customs, whatsapp_video_call, coercion"
RAG_CMP_0406,investment_fraud,"I was added to a Telegram group promising 300% returns on crypto investments. The members shared fake screenshots of huge profits. I am 21 years old and seeking financial stability in Chennai. I invested an initial sum, which showed a profit on their fake portal. Encouraged, I invested a total of Rs. 254,111. When I tried to withdraw, they blocked my account and vanished.",254111,Chennai,"investment_fraud, financial_loss, cybercrime"
RAG_CMP_0018,digital_arrest,"On October 03, 2024, I was at my residence in Ahmedabad when I received an unexpected phone call at around 20:46. The caller identified themselves as a senior investigating officer from the ED. The person sounded extremely authoritative and informed me that my Aadhaar card and PAN card details had been found implicated in a major money laundering and contraband smuggling case involving millions of rupees. I am a 60-year-old citizen with no criminal record, and I was completely terrified by this sudden allegation. They immediately escalated the situation by ordering me to isolate myself in an empty room and forcing me to join a Skype call. Once connected, I saw individuals dressed in official-looking uniforms sitting in a room that closely resembled a real police station, complete with national emblems and official insignia. They declared that I was under 'digital arrest' and strictly prohibited me from muting the microphone, turning off the camera, or contacting any family members or legal counsel. They displayed highly realistic forged documents bearing my name, photograph, and official government stamps, claiming an arrest warrant had already been authorized by the Supreme Court. I was kept under constant surveillance on this harrowing call for over 15 hours without any break. Exploiting my extreme fear, confusion, and panic, the impersonators instructed me to transfer all my personal savings to a 'secret secure ED investigation account' to verify my innocence. They promised the entire amount would be reversed back to my account within 24 hours once my financial audit was clear. Out of sheer panic, I initiated multiple transactions totaling Rs. 3,599,538 via RTGS. It was only after the perpetrators abruptly disconnected the call the next evening that I contacted the actual local police station and realized I had been the victim of an elaborate and devastating psychological scam.",3599538,Ahmedabad,"digital_arrest, impersonation, ed, skype_call, coercion"
RAG_CMP_0466,loan_app_fraud,"I downloaded a quick loan app from the Play Store to cover a medical emergency in Kolkata. I applied for a 5,000 rupee loan but they only disbursed 3,000, claiming the rest was processing fees. A week later, they demanded Rs. 48,814 and threatened to send morphed obscene photos of me to all my contacts using the contact list permission I had originally granted. The harassment was unbearable.",48814,Kolkata,"loan_app_fraud, financial_loss, cybercrime"
RAG_CMP_0229,upi_phishing,"I received an SMS stating that my electricity bill for my Lucknow residence was unpaid and power would be disconnected tonight. The message contained a payment link. I clicked it and was redirected to a payment gateway that looked legitimate. I entered my UPI details, and Rs. 24,752 was withdrawn automatically. The sender's number is now switched off.",24752,Lucknow,"upi_phishing, financial_loss, cybercrime"
RAG_CMP_0407,investment_fraud,"An Instagram influencer promoted a stock trading platform that uses 'AI algorithms' for guaranteed profits. I created an account and transferred Rs. 61,853 via bank transfer. Over a few weeks, the dashboard showed my portfolio tripling in value. However, any withdrawal request prompted a demand for 30% 'tax payments' upfront. It was an elaborate Ponzi scheme.",61853,Kolkata,"investment_fraud, financial_loss, cybercrime"
RAG_CMP_0141,digital_arrest,"I am filing this formal complaint regarding a highly sophisticated cyber fraud that occurred on July 24, 2024. I am a 47-year-old resident of Chennai. I received an automated Interactive Voice Response (IVR) call claiming that a mobile number registered in my name was being used to send illegal threat messages and that my cellular services would be blocked in two hours. I pressed '9' to speak to an executive and was connected to a man claiming to represent CBI. He transferred my call to what he described as the 'cyber crime investigation branch'. I was then manipulated into logging on to a WhatsApp video call for formal questioning. The individuals on the screen were wearing uniforms and sitting behind heavy wooden desks with the CBI logo prominently displayed in the background. They informed me that multiple bank accounts had been opened using my PAN card to fund illicit activities across international borders. They convinced me that I was a prime suspect and placed me under a so-called 'digital arrest'. They claimed that my local physical movements were currently being tracked and any attempt to log off would result in immediate physical detention by a local raid team. Under incredible mental distress and duress spanning 44 hours, they convinced me that the only way to avoid formal imprisonment was to deposit a 'security clearance bond'. Desperate to defend my reputation and believing their threats were completely legitimate, I gathered funds by liquidating my fixed deposits and transferred Rs. 4,800,645 using bank transfer to the accounts they dictated. The scammers assured me the money was just held in an escrow account. I am left financially ruined and deeply traumatized by this impersonation scam.",4800645,Chennai,"digital_arrest, impersonation, cbi, whatsapp_video_call, coercion"
RAG_CMP_0096,digital_arrest,"On May 16, 2024, I was at my residence in Hyderabad when I received an unexpected phone call at around 16:08. The caller identified themselves as a senior investigating officer from the TRAI. The person sounded extremely authoritative and informed me that my Aadhaar card and PAN card details had been found implicated in a major money laundering and contraband smuggling case involving millions of rupees. I am a 58-year-old citizen with no criminal record, and I was completely terrified by this sudden allegation. They immediately escalated the situation by ordering me to isolate myself in an empty room and forcing me to join a Zoom call. Once connected, I saw individuals dressed in official-looking uniforms sitting in a room that closely resembled a real police station, complete with national emblems and official insignia. They declared that I was under 'digital arrest' and strictly prohibited me from muting the microphone, turning off the camera, or contacting any family members or legal counsel. They displayed highly realistic forged documents bearing my name, photograph, and official government stamps, claiming an arrest warrant had already been authorized by the Supreme Court. I was kept under constant surveillance on this harrowing call for over 15 hours without any break. Exploiting my extreme fear, confusion, and panic, the impersonators instructed me to transfer all my personal savings to a 'secret secure TRAI investigation account' to verify my innocence. They promised the entire amount would be reversed back to my account within 24 hours once my financial audit was clear. Out of sheer panic, I initiated multiple transactions totaling Rs. 482,950 via crypto exchange transfer. It was only after the perpetrators abruptly disconnected the call the next evening that I contacted the actual local police station and realized I had been the victim of an elaborate and devastating psychological scam.",482950,Hyderabad,"digital_arrest, impersonation, trai, zoom_call, coercion"
RAG_CMP_0110,digital_arrest,"My nightmare began on the morning of May 10, 2024 in Hyderabad. I received an urgent call from someone pretending to be a customs official at the international airport. They claimed that a parcel addressed to me contained illegal narcotics and multiple expired passports. When I denied any knowledge of the parcel, they stated the matter was being escalated to the Customs and forced me to immediately download an application to initiate a WhatsApp video call. I am 56 years old and not very tech-savvy, so I blindly followed their instructions out of fear of legal trouble. Upon joining the call, a person dressed as a senior Customs director interrogated me aggressively. They digitally projected a fake FIR document onto the screen, which had my exact residential address and identity details. They told me I could not leave the camera frame and declared me under 'digital arrest'. I was held hostage virtually for 42 straight hours. Whenever I requested to drink water or use the restroom, they threatened to send local constables to publicly arrest me in front of my neighbors. They convinced me to temporarily transfer Rs. 3,918,405 to an 'auditor verification ledger' via bank transfer to prove that my funds were legally acquired and not linked to the intercepted parcel. Believing my life and career were on the line, I complied with all their demands. After the initial transfer, they demanded further payments, at which point I became suspicious and disconnected. I immediately checked with my bank, but the funds had already been moved.",3918405,Hyderabad,"digital_arrest, impersonation, customs, whatsapp_video_call, coercion"
RAG_CMP_0182,digital_arrest,"On October 05, 2024, I was at my residence in Mumbai when I received an unexpected phone call at around 15:16. The caller identified themselves as a senior investigating officer from the CBI. The person sounded extremely authoritative and informed me that my Aadhaar card and PAN card details had been found implicated in a major money laundering and contraband smuggling case involving millions of rupees. I am a 37-year-old citizen with no criminal record, and I was completely terrified by this sudden allegation. They immediately escalated the situation by ordering me to isolate myself in an empty room and forcing me to join a Skype call. Once connected, I saw individuals dressed in official-looking uniforms sitting in a room that closely resembled a real police station, complete with national emblems and official insignia. They declared that I was under 'digital arrest' and strictly prohibited me from muting the microphone, turning off the camera, or contacting any family members or legal counsel. They displayed highly realistic forged documents bearing my name, photograph, and official government stamps, claiming an arrest warrant had already been authorized by the Supreme Court. I was kept under constant surveillance on this harrowing call for over 27 hours without any break. Exploiting my extreme fear, confusion, and panic, the impersonators instructed me to transfer all my personal savings to a 'secret secure CBI investigation account' to verify my innocence. They promised the entire amount would be reversed back to my account within 24 hours once my financial audit was clear. Out of sheer panic, I initiated multiple transactions totaling Rs. 4,373,350 via IMPS/NEFT. It was only after the perpetrators abruptly disconnected the call the next evening that I contacted the actual local police station and realized I had been the victim of an elaborate and devastating psychological scam.",4373350,Mumbai,"digital_arrest, impersonation, cbi, skype_call, coercion"
RAG_CMP_0089,digital_arrest,"I am filing this formal complaint regarding a highly sophisticated cyber fraud that occurred on August 12, 2024. I am a 29-year-old resident of Bangalore. I received an automated Interactive Voice Response (IVR) call claiming that a mobile number registered in my name was being used to send illegal threat messages and that my cellular services would be blocked in two hours. I pressed '9' to speak to an executive and was connected to a man claiming to represent CBI. He transferred my call to what he described as the 'cyber crime investigation branch'. I was then manipulated into logging on to a WhatsApp video call for formal questioning. The individuals on the screen were wearing uniforms and sitting behind heavy wooden desks with the CBI logo prominently displayed in the background. They informed me that multiple bank accounts had been opened using my PAN card to fund illicit activities across international borders. They convinced me that I was a prime suspect and placed me under a so-called 'digital arrest'. They claimed that my local physical movements were currently being tracked and any attempt to log off would result in immediate physical detention by a local raid team. Under incredible mental distress and duress spanning 20 hours, they convinced me that the only way to avoid formal imprisonment was to deposit a 'security clearance bond'. Desperate to defend my reputation and believing their threats were completely legitimate, I gathered funds by liquidating my fixed deposits and transferred Rs. 4,824,854 using IMPS/NEFT to the accounts they dictated. The scammers assured me the money was just held in an escrow account. I am left financially ruined and deeply traumatized by this impersonation scam.",4824854,Bangalore,"digital_arrest, impersonation, cbi, whatsapp_video_call, coercion"
RAG_CMP_0219,upi_phishing,"I received an SMS stating that my electricity bill for my Hyderabad residence was unpaid and power would be disconnected tonight. The message contained a payment link. I clicked it and was redirected to a payment gateway that looked legitimate. I entered my UPI details, and Rs. 306,840 was withdrawn automatically. The sender's number is now switched off.",306840,Hyderabad,"upi_phishing, financial_loss, cybercrime"
RAG_CMP_0196,digital_arrest,"On July 29, 2024, I was at my residence in Jaipur when I received an unexpected phone call at around 20:26. The caller identified themselves as a senior investigating officer from the CBI. The person sounded extremely authoritative and informed me that my Aadhaar card and PAN card details had been found implicated in a major money laundering and contraband smuggling case involving millions of rupees. I am a 30-year-old citizen with no criminal record, and I was completely terrified by this sudden allegation. They immediately escalated the situation by ordering me to isolate myself in an empty room and forcing me to join a Skype call. Once connected, I saw individuals dressed in official-looking uniforms sitting in a room that closely resembled a real police station, complete with national emblems and official insignia. They declared that I was under 'digital arrest' and strictly prohibited me from muting the microphone, turning off the camera, or contacting any family members or legal counsel. They displayed highly realistic forged documents bearing my name, photograph, and official government stamps, claiming an arrest warrant had already been authorized by the Supreme Court. I was kept under constant surveillance on this harrowing call for over 35 hours without any break. Exploiting my extreme fear, confusion, and panic, the impersonators instructed me to transfer all my personal savings to a 'secret secure CBI investigation account' to verify my innocence. They promised the entire amount would be reversed back to my account within 24 hours once my financial audit was clear. Out of sheer panic, I initiated multiple transactions totaling Rs. 4,065,333 via crypto exchange transfer. It was only after the perpetrators abruptly disconnected the call the next evening that I contacted the actual local police station and realized I had been the victim of an elaborate and devastating psychological scam.",4065333,Jaipur,"digital_arrest, impersonation, cbi, skype_call, coercion"
RAG_CMP_0307,qr_code_scam,"While visiting a local shop in Ahmedabad, I tried to pay using a QR code pasted on the wall. After scanning, I made a payment of Rs. 353,333. Later, the shopkeeper said he didn't receive it. It turns out someone had pasted a fake QR code sticker over the original one. I lost my money and had to pay the shopkeeper again.",353333,Ahmedabad,"qr_code_scam, financial_loss, cybercrime"
RAG_CMP_0498,loan_app_fraud,"I am a 43-year-old from Bangalore. I took a small loan from a digital lending app. I repaid it on time, but they claimed the payment failed and added exorbitant late fees. They started calling my relatives and colleagues, accusing me of being a thief. Forced by the immense social humiliation and continuous threats, I ended up paying Rs. 67,548 to these blackmailers.",67548,Bangalore,"loan_app_fraud, financial_loss, cybercrime"
RAG_CMP_0313,qr_code_scam,"While visiting a local shop in Kolkata, I tried to pay using a QR code pasted on the wall. After scanning, I made a payment of Rs. 145,259. Later, the shopkeeper said he didn't receive it. It turns out someone had pasted a fake QR code sticker over the original one. I lost my money and had to pay the shopkeeper again.",145259,Kolkata,"qr_code_scam, financial_loss, cybercrime"
RAG_CMP_0222,upi_phishing,"I received an SMS stating that my electricity bill for my Bangalore residence was unpaid and power would be disconnected tonight. The message contained a payment link. I clicked it and was redirected to a payment gateway that looked legitimate. I entered my UPI details, and Rs. 382,423 was withdrawn automatically. The sender's number is now switched off.",382423,Bangalore,"upi_phishing, financial_loss, cybercrime"
RAG_CMP_0087,digital_arrest,"I am filing this formal complaint regarding a highly sophisticated cyber fraud that occurred on April 29, 2024. I am a 39-year-old resident of Mumbai. I received an automated Interactive Voice Response (IVR) call claiming that a mobile number registered in my name was being used to send illegal threat messages and that my cellular services would be blocked in two hours. I pressed '9' to speak to an executive and was connected to a man claiming to represent TRAI. He transferred my call to what he described as the 'cyber crime investigation branch'. I was then manipulated into logging on to a Skype call for formal questioning. The individuals on the screen were wearing uniforms and sitting behind heavy wooden desks with the TRAI logo prominently displayed in the background. They informed me that multiple bank accounts had been opened using my PAN card to fund illicit activities across international borders. They convinced me that I was a prime suspect and placed me under a so-called 'digital arrest'. They claimed that my local physical movements were currently being tracked and any attempt to log off would result in immediate physical detention by a local raid team. Under incredible mental distress and duress spanning 45 hours, they convinced me that the only way to avoid formal imprisonment was to deposit a 'security clearance bond'. Desperate to defend my reputation and believing their threats were completely legitimate, I gathered funds by liquidating my fixed deposits and transferred Rs. 647,099 using crypto exchange transfer to the accounts they dictated. The scammers assured me the money was just held in an escrow account. I am left financially ruined and deeply traumatized by this impersonation scam.",647099,Mumbai,"digital_arrest, impersonation, trai, skype_call, coercion"
RAG_CMP_0311,qr_code_scam,"A person approached me saying he had urgent cash but needed an online transfer. He gave me Rs. 2000 in physical cash and asked me to scan his QR code to transfer the equivalent amount. I scanned and authorized Rs. 406,032, but soon realized the cash he handed me were counterfeit notes. I am a 58-year-old resident of Jaipur.",406032,Jaipur,"qr_code_scam, financial_loss, cybercrime"
RAG_CMP_0342,fake_customer_care,"I was facing issues with my broadband connection in Kolkata. I googled the customer care number and called the first result. The person on the other end asked me to install a remote access app called AnyDesk to fix the router settings. Within minutes of granting access, they opened my banking app and transferred Rs. 442,736 out of my account. I am 28 years old.",442736,Kolkata,"fake_customer_care, financial_loss, cybercrime"
RAG_CMP_0022,digital_arrest,"On April 07, 2024, I was at my residence in Lucknow when I received an unexpected phone call at around 09:06. The caller identified themselves as a senior investigating officer from the Police. The person sounded extremely authoritative and informed me that my Aadhaar card and PAN card details had been found implicated in a major money laundering and contraband smuggling case involving millions of rupees. I am a 33-year-old citizen with no criminal record, and I was completely terrified by this sudden allegation. They immediately escalated the situation by ordering me to isolate myself in an empty room and forcing me to join a Zoom call. Once connected, I saw individuals dressed in official-looking uniforms sitting in a room that closely resembled a real police station, complete with national emblems and official insignia. They declared that I was under 'digital arrest' and strictly prohibited me from muting the microphone, turning off the camera, or contacting any family members or legal counsel. They displayed highly realistic forged documents bearing my name, photograph, and official government stamps, claiming an arrest warrant had already been authorized by the Supreme Court. I was kept under constant surveillance on this harrowing call for over 28 hours without any break. Exploiting my extreme fear, confusion, and panic, the impersonators instructed me to transfer all my personal savings to a 'secret secure Police investigation account' to verify my innocence. They promised the entire amount would be reversed back to my account within 24 hours once my financial audit was clear. Out of sheer panic, I initiated multiple transactions totaling Rs. 4,017,584 via bank transfer. It was only after the perpetrators abruptly disconnected the call the next evening that I contacted the actual local police station and realized I had been the victim of an elaborate and devastating psychological scam.",4017584,Lucknow,"digital_arrest, impersonation, police, zoom_call, coercion"
RAG_CMP_0297,qr_code_scam,"While visiting a local shop in Kolkata, I tried to pay using a QR code pasted on the wall. After scanning, I made a payment of Rs. 468,315. Later, the shopkeeper said he didn't receive it. It turns out someone had pasted a fake QR code sticker over the original one. I lost my money and had to pay the shopkeeper again.",468315,Kolkata,"qr_code_scam, financial_loss, cybercrime"
